status_id,status_message,link_name,status_type,status_link,status_published,num_reactions,num_comments,num_shares,num_likes,num_loves,num_wows,num_hahas,num_sads,num_angries,num_thankfuls,stress_score,topic
5550296508_10157492755831509,"b'Sen. Jim Risch: ""That\'s your job""\n\nCNN\'s Wolf Blitzer: ""But that\'s your job -- you\'re a United States senator.""'","b""GOP senator denies it's his job to call Trump out""",link,http://www.cnn.com/2017/10/24/politics/james-risch-wolf-blizter-cnn-tv/index.html?sr=fbCNN102417james-risch-wolf-blizter-cnn-tv1028PMVODtopLink,2017-10-25 04:00:45,4602,1225,452,1829,43,320,495,179,1736,0,-0.24828705373241977,politics,james-risch-wolf-blizter-cnn-tv
5550296508_10157492712141509,"b'Charlie McEvoy told his wife if their home had been destroyed in the wildfires, they would use their home construction expertise to build a new home.\n\n""Why don\'t you just do that?"" she said.'",b'Contractor building three tiny homes to help California wildfire victims',link,http://www.cnn.com/2017/10/24/us/santa-rosa-tiny-homes-trnd/index.html?sr=fbCNN102417santa-rosa-tiny-homes-trnd1035PMStoryLink,2017-10-25 03:31:05,804,34,48,715,73,11,2,2,1,0,0.4044943820224719,us,santa-rosa-tiny-homes-trnd
5550296508_10157492665051509,"b'Albert Einstein told a messenger to keep the notes, ""as their future value may be much higher than a standard tip.""'","b""Einstein's handwritten notes sell for $1.8M""",link,http://www.cnn.com/style/article/einstein-handwritten-notes-auction/index.html?sr=fbCNN102517undefined0152PMStory,2017-10-25 03:00:09,4747,103,386,3737,217,746,38,6,3,0,0.12178217821782178,index.html?sr=fbCNN102517undefined0152PMStory,
5550296508_10157492389836509,"b'9. ""We were not made great as a country by indulging or even exalting our worst impulses, turning against ourselves, glorying in the things which divide us, and calling fake things true and true things fake.""'","b""Jeff Flake's 9 toughest hits on Trump""",link,http://www.cnn.com/2017/10/24/politics/jeff-flake-senate-speech-lines/index.html?sr=fbCNN102417jeff-flake-senate-speech-lines0555PMVODtopLink,2017-10-25 00:31:06,7002,455,604,5918,911,94,60,13,6,0,0.43911439114391143,politics,jeff-flake-senate-speech-lines
5550296508_10157492284121509,"b'Sarah Sanders rattled off a list of accomplishments she believes President Donald J. Trump can claim, including helping to defeat ISIS and boost the economy. CNN fact-checked her list.'","b""Fact check: Sanders' list of Trump accomplishments""",link,http://www.cnn.com/2017/10/24/politics/sarah-sanders-white-house-fact-check/index.html?sr=fbCNN102417sarah-sanders-white-house-fact-check0802PMVODtopLink,2017-10-25 00:01:07,13705,2948,1388,3513,113,272,8232,159,1416,0,0.3321232339089482,politics,sarah-sanders-white-house-fact-check
5550296508_10157492221951509,"b'The arrangement with the firm, which has ties to the Donald J. Trump administration, has raised a few eyebrows among Democrats.'",b'Questions swirl after small Montana firm lands Puerto Rico power contract',link,http://money.cnn.com/2017/10/24/news/economy/puerto-rico-whitefish-trump-contract/index.html?sr=fbCNN102417economy0812PMStoryLink,2017-10-24 23:31:03,3086,604,655,997,12,480,87,44,1466,0,-0.3377213977979895,news,
5550296508_10157492148891509,"b'""I have children and grandchildren to answer to, and so, Mr. President, I will not be complicit.""'","b""Jeff Flake's full speech announcing he won't run for re-election""",link,http://www.cnn.com/2017/10/24/politics/jeff-flake-retirement-speech-full-text/index.html?sr=fbCNN102517jeff-flake-retirement-speech-full-text1139AMVODtop,2017-10-24 23:00:27,12250,744,1166,10052,1894,114,147,29,14,0,0.45450409463148317,politics,jeff-flake-retirement-speech-full-text
5550296508_10157492055626509,"b'""I\'ve buried my mother, my father, and my oldest brother in the last four years and this is the hardest thing I\'ve ever done in my life,"" the victim\'s father told a CNN affiliate.'",b'5 teens denied bond in deadly highway rock-throwing case',link,http://www.cnn.com/2017/10/24/us/michigan-teens-rock-throwing-death-trnd/index.html?sr=fbCNN102417michigan-teens-rock-throwing-death-trnd1006PMVODtopLink,2017-10-24 22:30:01,38979,5312,6482,20554,346,977,159,9159,7784,0,-0.44607869742198103,us,michigan-teens-rock-throwing-death-trnd
5550296508_10157492034806509,b'Vice President Mike Pence cast the tie-breaking vote',b'Senate votes to kill rule that made it easier to sue banks and credit card companies',link,http://www.cnn.com/2017/10/24/politics/senate-cfpb-arbitration-repeal/index.html?sr=fbCNN102417senate-cfpb-arbitration-repeal1120PMStoryLink,2017-10-24 22:23:29,10989,1661,2681,1541,32,372,138,669,8238,0,-0.4623240554556038,politics,senate-cfpb-arbitration-repeal
5550296508_10157491969106509,b'Millennials are much more transparent with their salary information',b'Is it smart to say how much you make?',link,http://money.cnn.com/2017/10/19/pf/jobs/share-salary-millennial-workers/index.html?sr=fbCNN102317jobs0402PMStory,2017-10-24 22:01:16,591,154,75,546,15,6,20,2,2,0,0.34444444444444444,pf,
5550296508_10157491968661509,b'Open enrollment season at the office can be frustrating',b'How to choose your health insurance plan and other workplace benefits',link,http://money.cnn.com/2017/10/23/pf/applenews-how-to-buy-health-insurance/index.html?sr=fbCNN102317applenews-how-to-buy-health-insurance0339PMStory,2017-10-24 22:01:06,175,32,31,146,13,6,3,1,6,0,0.15517241379310345,pf,applenews-how-to-buy-health-insurance
5550296508_10157491893711509,"b""CNN's Chris Cillizza writes that the announcement of a probe into a US-Russia uranium deal from the Barack Obama era is a way for congressional Republicans to change the subject from recent news about Donald J. Trump and do some service for their base.""",b'Cillizza: Launch probes! Congressional GOPers try desperately to take focus off Trump',link,http://www.cnn.com/2017/10/24/politics/republican-investigations-clinton/index.html?sr=fbCNN102417republican-investigations-clinton0923PMVODtopLink,2017-10-24 21:31:43,2855,1458,333,1225,35,65,689,66,775,0,-0.03588957055214724,politics,republican-investigations-clinton
5550296508_10157491806016509,"b""Hillary Clinton's presidential campaign and the DNC helped fund research that led to the now-infamous dossier of allegations about President Donald J. Trump and Russia, a source tells CNN.""","b'Clinton campaign, DNC helped fund dossier research'",link,http://www.cnn.com/2017/10/24/politics/fusion-gps-clinton-campaign/index.html?sr=fbCNN102417fusion-gps-clinton-campaign0957PMVODtopLink,2017-10-24 21:01:24,3150,1797,400,2100,291,112,537,13,97,0,0.3419047619047619,politics,fusion-gps-clinton-campaign
5550296508_10157491717091509,"b""House Republicans announced a probe into the circumstances surrounding the sale of a uranium mining company to Russia's Atomic Energy Agency, Rosatam, that was approved by the Barack Obama administration in 2010.""","b'Obama-era uranium deal yields new questions, new accusations and new investigation'",link,http://www.cnn.com/2017/10/24/politics/obama-era-uranium-deal/index.html?sr=fbCNN102417obama-era-uranium-deal0849PMVODtopLink,2017-10-24 20:31:12,2965,2306,383,1404,124,126,812,46,453,0,0.13997437540038438,politics,obama-era-uranium-deal
5550296508_10157491483716509,"b'Two other necrotizing fasciitis infections have been reported in the area, one fatal'",b'Man who repaired Harvey-flooded homes dies of flesh-eating bacteria',link,http://www.cnn.com/2017/10/24/health/houston-flood-flesh-eating-bacteria-kills-man-bn/index.html?sr=fbCNN102417houston-flood-flesh-eating-bacteria-kills-man-bn0705PMVODtopLink,2017-10-24 19:31:12,11275,189,1763,1625,24,1546,7,8000,73,0,-0.41668393782383417,health,houston-flood-flesh-eating-bacteria-kills-man-bn
5550296508_10157491411176509,"b'Robert Guillaume was best known for his title role in the TV series ""Benson,"" and treasured being Rafiki in The Lion King.'","b""Robert Guillaume, 'Benson' star, dies at 89""",link,http://www.cnn.com/2017/10/24/entertainment/robert-guillaume-obit/index.html?sr=fbCNN102417robert-guillaume-obit0528PMStoryLink,2017-10-24 19:02:13,7508,368,1865,2167,376,97,5,4849,14,0,-0.4195843475004681,entertainment,robert-guillaume-obit
5550296508_10157491326006509,"b""Neighbors told the FBI that agents once visited the Sandy Hook killer's home after he hacked a government computer when he was in the 9th grade, according to one of the documents.""",b'Unsealed FBI docs paint disturbing portrait of Sandy Hook shooter',link,http://www.cnn.com/2017/10/24/us/sandy-hook-adam-lanza-unsealed-docs/index.html?sr=fbCNN102417sandy-hook-adam-lanza-unsealed-docs0604PMStoryLink,2017-10-24 18:31:10,1253,161,161,665,27,348,6,61,146,0,-0.14795918367346939,us,sandy-hook-adam-lanza-unsealed-docs
5550296508_10157491164261509,"b'Senator Flake sacrificed himself -- and his political career -- to try to shake Republicans out of their stupor, writes Chris Cillizza'","b""Jeff Flake's kamikaze mission against Donald Trump just ended""",link,http://www.cnn.com/2017/10/24/politics/jeff-flake-trump-retiring/index.html?sr=fbCNN102417jeff-flake-trump-retiring0450PMVODtopLink,2017-10-24 17:29:06,16001,1582,945,13204,1982,232,414,134,35,0,0.398105112620665,politics,jeff-flake-trump-retiring
5550296508_10157491089866509,b'A US appeals court just cleared the way for an undocumented teen in detention in Texas to end her pregnancy',b'Appeals court paves way for undocumented teen to have abortion',link,http://www.cnn.com/2017/10/24/politics/undocumented-teen-immigrant-abortion-case/index.html?sr=fbCNN102417undocumented-teen-immigrant-abortion-case0447PMStoryLink,2017-10-24 17:00:48,4516,398,129,3641,635,40,7,56,137,0,0.25657142857142856,politics,undocumented-teen-immigrant-abortion-case
5550296508_10157490966201509,b'And then there were two: the US and Syria',b'US and Syria are now the only two countries not in the Paris Climate Accord',link,http://www.cnn.com/2017/10/24/politics/nicaragua-paris-climate-accord-us-syria/index.html?sr=fbCNN102417nicaragua-paris-climate-accord-us-syria0200PMVODtopLink,2017-10-24 16:34:03,4081,520,619,1516,73,173,122,636,1561,0,-0.3902534113060429,politics,nicaragua-paris-climate-accord-us-syria
5550296508_10157490069586509,"b'President Donald J. Trump ""looked at me and said, \'I heard that the big mountain in Alaska also had -- also its name was changed by executive action. Do you want us to reverse that?\'"" Senator Dan Sullivan said'",b'Trump asked about reversing Obama to rename Denali as Mt. McKinley',link,http://www.cnn.com/2017/10/24/politics/trump-denali-mt-mckinley/index.html?sr=fbCNN102417trump-denali-mt-mckinley1251PMVODtopLink,2017-10-24 13:27:05,11536,2691,1871,2331,145,1722,804,348,6186,0,-0.3033677349266703,politics,trump-denali-mt-mckinley
5550296508_10157489993431509,b'Her spontaneous bleeding episodes had no obvious trigger',b'The woman who sweats blood',link,http://www.cnn.com/2017/10/24/health/sweating-blood-case-study/index.html?sr=fbCNN102417sweating-blood-case-study1148AMVODtopLink,2017-10-24 13:00:27,1420,197,265,729,30,541,5,112,3,0,-0.05788712011577424,health,sweating-blood-case-study
5550296508_10157489596911509,"b'By invoking Benghazi, though, Democratic officials and their liberal allies risk a critical miscalculation, writes Gregory Krieg'","b""Democrats should not make Niger 'Trump's Benghazi.' Here's why.""",link,http://www.cnn.com/2017/10/24/politics/niger-benghazi-trump-democrats/index.html?sr=fbCNN102417niger-benghazi-trump-democrats1125AMVODtopLink,2017-10-24 11:00:30,927,631,80,753,22,22,105,7,18,0,0.29310344827586204,politics,niger-benghazi-trump-democrats
5550296508_10157489508826509,"b'2. ""I think world leaders are very aware that much of what he says is untrue.""'","b""Bob Corker's 9 most devastating lines on Donald Trump in his CNN interview, ranked""",link,http://www.cnn.com/2017/10/24/politics/corker-interview-manu-best-lines/index.html?sr=fbCNN102417corker-interview-manu-best-lines1103AMVODtopLink,2017-10-24 10:31:19,8436,838,716,6843,799,151,528,75,40,0,0.3804143126177024,politics,corker-interview-manu-best-lines
5550296508_10157489423416509,"b""Here's a list of the senators -- and what President Donald J. Trump has said about each""",b'Donald Trump has now personally attacked 1 in 5 Republican senators',link,http://www.cnn.com/2017/10/24/politics/trump-gop-senators-corker/index.html?sr=fbCNN102417trump-gop-senators-corker1058AMVODtopLink,2017-10-24 10:03:03,3833,1284,591,1476,60,606,1122,204,365,0,0.13003818413237167,politics,trump-gop-senators-corker
5550296508_10157488992511509,b'The inventor claims the jacket mitigates almost all human error and can diagnose pneumonia three to four times faster than a doctor.',b'This biomedical smart jacket diagnoses pneumonia using Bluetooth',link,http://www.cnn.com/2017/10/24/africa/biomedical-jacket-uganda-africa-tech-rising/index.html?sr=fbCNN102417biomedical-jacket-uganda-africa-tech-rising0741AMStory,2017-10-24 08:00:15,982,45,165,732,50,192,4,2,2,0,0.1,africa,biomedical-jacket-uganda-africa-tech-rising
5550296508_10157488831031509,"b""The more astronomers learn about Saturn's largest moon, Titan, the weirder it gets.""",b'What Cassini learned about Saturn during its death dive',link,http://www.cnn.com/2017/10/24/us/cassini-saturn-atmosphere-rings/index.html?sr=fbCNN102417cassini-saturn-atmosphere-rings0427PMStoryGal,2017-10-24 07:00:37,2258,73,325,1972,131,146,6,2,1,0,0.23426573426573427,us,cassini-saturn-atmosphere-rings
5550296508_10157488751946509,b'The case of a pregnant migrant teen held in Texas and blocked by the Trump administration from obtaining an abortion may be heading toward a point of no return.',b'First major abortion battle of Trump era could be headed for Supreme Court',link,http://www.cnn.com/2017/10/24/politics/texas-case-pregnant-migrant-teen-abortion-federal-court/index.html?sr=fbCNN102417texas-case-pregnant-migrant-teen-abortion-federal-court0633AMStory,2017-10-24 06:30:27,3611,963,381,1279,46,158,29,387,1712,0,-0.4339622641509434,politics,texas-case-pregnant-migrant-teen-abortion-federal-court
5550296508_10157488687581509,"b'Classes begin Tuesday in regions on opposite ends of the island, in San Juan and Mayaguez, according to education officials'",b'Puerto Rico reopening some schools after  hurricane devastation',link,http://www.cnn.com/2017/10/24/us/puerto-rico-recovery-schools/index.html?sr=fbCNN102417puerto-rico-recovery-schools0309PMVODtop,2017-10-24 06:01:44,725,53,52,656,59,8,0,2,0,0,0.41304347826086957,us,puerto-rico-recovery-schools
5550296508_10157488621781509,"b'Khan said in the aftermath of the Niger deaths, Kelly had focused on defending Donald J. Trump ""instead of honoring (the slain soldiers) and restraining from political expediency.""'","b""Gold Star father slams John Kelly's defense of Trump""",link,http://www.cnn.com/2017/10/24/politics/gold-star-father-khizr-khan-anderson-cooper-cnntv/index.html?sr=fbCNN102417gold-star-father-khizr-khan-anderson-cooper-cnntv0229PMVODtop,2017-10-24 05:30:32,4373,840,261,3565,359,27,52,302,68,0,0.025371287128712873,politics,gold-star-father-khizr-khan-anderson-cooper-cnntv
5550296508_10157488560306509,"b'""You are the commander in chief, the President of the United States of America, the greatest country on Earth. Act like it."" CNN\'s Don Lemon shares an open letter to Donald J. Trump, with a message for Myeshia Johnson, the widow of Sgt. La David Johnson'","b""Don Lemon's open letter to Trump: 'Please stop!'""",link,http://www.cnn.com/2017/10/24/opinions/don-lemon-letter-to-trump-la-david-johnson/index.html?sr=fbCNN102417don-lemon-letter-to-trump-la-david-johnson1231PMVODtop,2017-10-24 05:01:02,19444,1595,2392,14582,2841,92,136,1680,113,0,0.12176059234882765,opinions,don-lemon-letter-to-trump-la-david-johnson
5550296508_10157488515716509,b'The planned concrete structure features a 36-foot wide panoramic window on the seabed of the Norwegian coastline (Via CNN Style)',"b""Europe's first underwater restaurant to open in Norway""",link,http://www.cnn.com/style/article/snohetta-underwater-restaurant/index.html,2017-10-24 04:30:20,4243,306,647,3457,273,499,9,3,2,0,0.1762086513994911,index.html,
5550296508_10157488475031509,"b""Germany's new far-right politicians enter parliament today -- here's how they might influence the country and Europe""","b""First day on the job: Meet Germany's new far-right politicians""",link,http://edition.cnn.com/2017/10/24/europe/afd-germany-parliament-first-day/index.html?sr=twCNN102417afd-germany-parliament-first-day0936AMStory,2017-10-24 04:00:20,564,140,41,314,46,12,8,25,159,0,-0.26,europe,afd-germany-parliament-first-day
5550296508_10157488278401509,"b""A government report is sounding an alarm over the threat of climate change, and the US government's response.""",b'Government report calls on Trump to act on climate change',link,http://www.cnn.com/2017/10/23/politics/gao-report-climate-change/index.html?sr=fbCNN102317gao-report-climate-change0904PMStoryLink,2017-10-24 03:31:03,1662,403,260,1416,53,35,99,29,30,0,0.18902439024390244,politics,gao-report-climate-change
5550296508_10157488104281509,"b'We, in the international community, must recognize the Rohingya crisis in Myanmar as a genocide via CNN Opinion'","b""There's only one conclusion on the Rohingya in Myanmar: It's genocide""",link,http://www.cnn.com/2017/10/23/opinions/myanmar-rohingya-genocide/index.html?sr=fbCNN102317myanmar-rohingya-genocide0159PMVODtop,2017-10-24 02:31:03,3715,205,835,1542,20,37,11,1735,370,0,-0.4772204325816843,opinions,myanmar-rohingya-genocide
5550296508_10157488017951509,"b""For the first time ever, Stephen Hawking's doctoral thesis is available to the public -- if you can get the web page to load.""","b""Stephen Hawking's 1966 thesis crashes Cambridge University's website""",link,http://www.cnn.com/2017/10/23/europe/stephen-hawking-thesis/index.html?sr=fbCNN102317stephen-hawking-thesis0702PMStoryLink,2017-10-24 01:30:20,9726,344,1503,8230,601,778,107,7,3,0,0.23328877005347592,europe,stephen-hawking-thesis
5550296508_10157487965041509,b'Five teenagers from Michigan have been charged with second-degree murder.',b'Rock dropped from overpass kills passenger in car',link,http://www.cnn.com/2017/10/23/us/flint-teens-rock-throwing-murder-trnd/index.html?sr=fbCNN102317flint-teens-rock-throwing-murder-trnd0934PMVODtopLink,2017-10-24 01:00:05,12284,796,1273,3917,41,941,16,3144,4225,0,-0.4369547029998805,us,flint-teens-rock-throwing-murder-trnd
5550296508_10157487862451509,b'Police say the shooting deaths of three people in 11 days are linked.',b'Police escort kids to school after 3 killings in Tampa neighborhood',link,http://www.cnn.com/2017/10/23/us/tampa-homicides-seminole-heights/index.html?sr=fbCNN102317tampa-homicides-seminole-heights0808PMVODtopLink,2017-10-24 00:31:01,1530,95,182,725,12,236,4,525,28,0,-0.33354037267080744,us,tampa-homicides-seminole-heights
5550296508_10157487755131509,"b""Hurricane-battered Puerto Rico has submitted an application for Amazon.com's second HQ.""","b""Puerto Rico wants Amazon's second headquarters, too""",link,http://money.cnn.com/2017/10/23/technology/puerto-rico-amazon-bid/index.html?sr=fbCNN102317puerto-rico-amazon-bid0729PMStoryLink,2017-10-24 00:01:19,2385,262,105,1897,263,39,177,7,2,0,0.4415983606557377,technology,puerto-rico-amazon-bid
5550296508_10157487623716509,"b""The Weinstein Company's legal trouble just got worse""",b'New York Attorney General investigating Weinstein Company over Harvey Weinstein',link,http://money.cnn.com/2017/10/23/media/eric-schneiderman-investigating-weinstein-company/index.html?sr=fbCNN102317eric-schneiderman-investigating-weinstein-company0613PMStory,2017-10-23 23:02:02,605,130,39,522,28,9,37,3,6,0,0.3373493975903614,media,eric-schneiderman-investigating-weinstein-company
5550296508_10157487552781509,"b'""You know, am I mad at God? Yeah, I\'m mad at him. ... I wish I had more protection. I wish this stuff didn\'t happen. I can\'t explain it to you. Yeah, I\'m mad at him.""'","b""Bill O'Reilly 'mad at God' over sexual misconduct allegations""",link,http://money.cnn.com/2017/10/23/media/bill-oreilly-misconduct-allegations/index.html?sr=fbCNN102317bill-oreilly-misconduct-allegations0947PMStoryLink,2017-10-23 22:31:02,8994,3462,1584,1275,26,726,5262,106,1599,0,0.23208964891825365,media,bill-oreilly-misconduct-allegations
5550296508_10157487491991509,"b'It will be hotter than any game in Houston this year, and would shatter the World Series record set in Phoenix in 2001.'",b'Game 1 will likely set record for hottest World Series game temp',link,http://www.cnn.com/2017/10/23/us/record-world-series-weather/index.html?sr=fbCNN102317record-world-series-weather0652PMVODtopLink,2017-10-23 22:01:19,1408,152,199,885,9,394,26,86,8,0,-0.05640535372848948,us,record-world-series-weather
5550296508_10157487405621509,b'Former President George W. Bush made Barack Obama snicker as President Bill Clinton spoke',b'Bush cracks up Obama at hurricane relief concert',link,http://www.cnn.com/2017/10/23/politics/george-bush-makes-obama-laugh/index.html?sr=fbCNN102317george-bush-makes-obama-laugh0754PMVODtopLink,2017-10-23 21:31:11,9038,467,434,7304,1074,13,636,1,10,0,0.48990772779700115,politics,george-bush-makes-obama-laugh
5550296508_10157487131391509,b'Working from home is how Richard Branson balanced spending time with his two children while constantly spanning the globe and running his business',"b'Richard Branson to parents: Work from home, if you can'",link,http://money.cnn.com/2017/10/23/news/companies/richard-branson-boss-files/index.html?sr=fbCNN102317companies0512PMStory,2017-10-23 20:11:03,5663,364,876,5082,484,11,82,1,3,0,0.4836488812392427,news,
5550296508_10157487069086509,"b'Transporting goods to an island more than 1,000 miles off the U.S. coastline, with already crumbling infrastructure and little to no cell service, has proven to be a major challenge'",b'Relief groups hit major hurdles getting aid to Puerto Rico',link,http://money.cnn.com/2017/10/23/news/economy/puerto-rico-ad-hoc-aid-groups/index.html?sr=fbCNN102317economy0646PMStory,2017-10-23 19:50:14,588,162,105,369,26,18,4,159,12,0,-0.3219178082191781,news,
5550296508_10157486965886509,b'New moms around the world appear to have a universal response both in their behaviors and in their brains when they hear their babies cry',"b""What happens in a mother's brain when her baby cries""",link,http://www.cnn.com/2017/10/23/health/moms-babies-crying-response-universal-study/index.html?sr=fbCNN102317moms-babies-crying-response-universal-study0559PMStory,2017-10-23 19:00:57,911,153,185,807,65,30,7,2,0,0,0.33653846153846156,health,moms-babies-crying-response-universal-study
5550296508_10157486798036509,b'A White House official says bureaucratic issues are to blame for the delay on letters being sent out to families of fallen soldiers',b'White House blames bureaucracy on military letters',link,http://www.cnn.com/2017/10/23/politics/trump-condolence-letters-expedited/index.html?sr=fbCNN102317trump-condolence-letters-expedited0619PMStory,2017-10-23 18:00:11,3565,2244,349,601,34,155,1571,96,1108,0,0.06764507422402159,politics,trump-condolence-letters-expedited
5550296508_10157486700761509,"b'The US troops attacked in Niger were on their way back to their operating base when they were ambushed by 50 ISIS fighters, according to Joint Chiefs Chairman Gen. Joseph Dunford'",b'Top US general reveals new info on Niger ambush',link,http://www.cnn.com/2017/10/23/politics/dunford-niger-ambush-briefing/index.html?sr=fbCNN102317dunford-niger-ambush-briefing0541PMStory,2017-10-23 17:30:05,791,246,105,499,33,69,7,152,31,0,-0.24486301369863014,politics,dunford-niger-ambush-briefing
5550296508_10157486596026509,"b""People have stopped asking or caring about Donald J. Trump's taxes. Which means Trump's gamble is paying off, writes CNN's Chris Cillizza""","b""Donald Trump gambled you wouldn't care about his tax returns. He was right.""",link,http://www.cnn.com/2017/10/23/politics/trump-taxes/index.html?sr=fbCNN102317trump-taxes0510PMStory,2017-10-23 17:00:31,4570,2189,824,1677,59,92,217,171,2354,0,-0.3886968544763222,politics,trump-taxes
5550296508_10157486302586509,"b'Delta has more than 1,000 open flight attendant positions for 2018 and the competition is stiff'","b'Wanted: 1,000 new Delta flight attendants'",link,http://money.cnn.com/2017/10/23/pf/delta-hiring-flight-attendants/index.html?sr=fbCNN102317delta-hiring-flight-attendants0320PMStory,2017-10-23 16:00:25,3097,817,1585,2746,152,175,23,1,0,0,0.24786324786324787,pf,delta-hiring-flight-attendants
5550296508_10157486174291509,b'The genetic causes of breast cancer just got clearer',b'Global study finds 72 new breast cancer genes',link,http://www.cnn.com/2017/10/23/health/72-new-breast-cancer-mutations-study/index.html?sr=fbCNN10231772-new-breast-cancer-mutations-study0306PMStory,2017-10-23 15:29:01,2816,115,1052,1983,96,680,1,51,5,0,0.02460984393757503,health,72-new-breast-cancer-mutations-study
5550296508_10157486046451509,"b""Judges in two cases have ruled in favor of Johnson & Johnson, overturning large financial judgments awarded to plaintiffs who believe the company's products caused ovarian cancer""",b'Judge overturns record verdict in Johnson & Johnson talcum powder trial',link,http://www.cnn.com/2017/10/23/health/johnson-and-johnson-talcum-powder-trial-verdict-overturned/index.html?sr=fbCNN102317johnson-and-johnson-talcum-powder-trial-verdict-overturned0248PMStory,2017-10-23 15:00:45,1262,185,223,691,43,191,11,24,302,0,-0.2381786339754816,health,johnson-and-johnson-talcum-powder-trial-verdict-overturned
