status_id,status_message,link_name,status_type,status_link,status_published,num_reactions,num_comments,num_shares,num_likes,num_loves,num_wows,num_hahas,num_sads,num_angries,num_thankfuls,stress_score,topic
5550296508_10157499274986509,b'One of the suspects outlined alleged threats to specific staff members and students in her diary',"b'Georgia teens charged in alleged plot to attack high school, police say'",link,http://www.cnn.com/2017/10/26/us/georgia-students-high-school-plot/index.html?sr=fbCNN102617georgia-students-high-school-plot0155PMStory,2017-10-26 16:30:52,1439,428,272,713,31,287,22,80,306,0,-0.22933884297520662,us,georgia-students-high-school-plot
5550296508_10157499148956509,"b'The mandatory class, Patriotic Education and Fitness, teaches love of country and military skills like pistol and rifle marksmanship'",b'Missouri college requires students to attend patriotism class',link,http://www.cnn.com/2017/10/26/health/patriotism-class-trnd/index.html?sr=fbCNN102617patriotism-class-trnd0113PMStory,2017-10-26 16:01:05,3202,1176,406,1173,249,319,267,69,1125,0,-0.16707737801872843,health,patriotism-class-trnd
5550296508_10157499019926509,"b""Hillary Clinton's campaign chairman John Podesta and former DNC chairwoman Debbie Wasserman Schultz both privately denied to congressional Russia investigators that they had any knowledge about an arrangement to pay for opposition research on President Donald J. Trump""","b'Exclusive: In Hill interviews, top Dems denied knowledge of payments to firm behind Trump dossier'",link,http://www.cnn.com/2017/10/26/politics/john-podesta-debbie-wasserman-schultz-trump-dossier/index.html?sr=fbCNN102617john-podesta-debbie-wasserman-schultz-trump-dossier0329PMStory,2017-10-26 15:30:14,1200,1350,196,615,60,33,428,7,57,0,0.3623931623931624,politics,john-podesta-debbie-wasserman-schultz-trump-dossier
5550296508_10157498813156509,"b'""Now, the adultery of the woman is a very serious attack on the honor and dignity of the man,"" the ruling, which shocked many, said'","b""Man who viciously beat his ex-wife gets no jail time because judge says her infidelity 'dishonored' him""",link,http://www.cnn.com/2017/10/26/europe/portugal-honor-beating-trnd/index.html?sr=fbCNN102617portugal-honor-beating-trnd1207PMStoryLink,2017-10-26 14:30:47,8710,921,1491,1336,75,1262,95,186,5756,0,-0.39137510170870626,europe,portugal-honor-beating-trnd
5550296508_10157498605291509,"b'No, Donald J. Trump did not coin the term ""fake news"" \xe2\x80\x94 but he did redefine it'","b""Trump's 'fake news' boast is backward and irresponsible, writes Stelter""",link,http://money.cnn.com/2017/10/26/media/fake-news-donald-trump/index.html?sr=fbCNN102617fake-news-donald-trump1155AMVODtopLink,2017-10-26 13:30:34,959,763,65,656,55,13,192,10,33,0,0.33663366336633666,media,fake-news-donald-trump
5550296508_10157498311171509,b'You can now check how much Obamacare will cost you in 2018 (and you may be in for a shock)',"b""Here's what you'll pay in Obamacare premiums in 2018""",link,http://money.cnn.com/2017/10/26/news/economy/obamacare-premiums-open-enrollment/index.html?sr=fbCNN102617economy1131AMVODtopLink,2017-10-26 12:02:04,729,550,290,416,15,42,69,38,149,0,-0.1645367412140575,news,
5550296508_10157498219241509,"b""The Virginia governor's race has turned into a culture war -- and President Donald J. Trump just jumped right into it""","b""Trump jumps into Virginia's culture war governor's race""",link,http://www.cnn.com/2017/10/26/politics/virginia-governor-race-ralph-northam-ed-gillespie/index.html?sr=fbCNN102617virginia-governor-race-ralph-northam-ed-gillespie1126AMVODtopLink,2017-10-26 11:30:37,833,252,54,464,21,25,75,24,224,0,-0.20596205962059622,politics,virginia-governor-race-ralph-northam-ed-gillespie
5550296508_10157497955621509,b'Uber-style surge pricing may be coming to your movie theater next',b'Coming soon to a theater near you: Surge pricing for movies',link,http://money.cnn.com/2017/10/26/media/regal-cinemas-dynamic-pricing/index.html?sr=fbCNN102617regal-cinemas-dynamic-pricing1118AMStory,2017-10-26 10:31:18,907,401,158,409,14,56,63,21,344,0,-0.2891566265060241,media,regal-cinemas-dynamic-pricing
5550296508_10157497860551509,"b'It may have belonged to the earliest known human victim of a tsunami, scientists say'",b'Ancient skull may belong to earliest tsunami victim',link,http://www.cnn.com/2017/10/26/world/ancient-skull-tsunami-victim/index.html?sr=fbCNN102617ancient-skull-tsunami-victim1103AMStoryLink,2017-10-26 10:04:45,631,80,50,515,13,93,5,5,0,0,0.05603448275862069,world,ancient-skull-tsunami-victim
5550296508_10157497749911509,"b'They were the Americans that Donald J. Trump and congressional Republicans promised to help by repealing and replacing Obamacare.\n\nInstead, they will be hit the hardest.'","b""Trump's quest to kill Obamacare is going to hurt the middle class""",link,http://money.cnn.com/2017/10/26/news/economy/trump-obamacare-premiums/index.html?sr=fbCNN102617economy0926AMVODtopLink,2017-10-26 09:29:05,5474,1620,1361,2382,33,135,652,544,1728,0,-0.2566300129366106,news,
5550296508_10157497519731509,"b""JUST IN: President Donald J. Trump will declare the opioid epidemic a public health emergency later today but won't order additional federal funding""",b'Trump to declare opioid epidemic a public health emergency',link,http://www.cnn.com/2017/10/26/politics/donald-trump-opioid-epidemic/index.html?sr=fbCNN102617donald-trump-opioid-epidemic0918AMVODtopLink,2017-10-26 08:30:14,2689,1726,443,1080,47,119,607,86,750,0,-0.05655686761963953,politics,donald-trump-opioid-epidemic
5550296508_10157497409726509,b'Officials suspect a fire broke out from an electric short circuit before triggering the explosion.',b'At least 47 killed in Indonesia fireworks factory explosion',link,http://www.cnn.com/2017/10/26/asia/indonesia-fireworks-factor-explosion/index.html?sr=fbCNN102617indonesia-fireworks-factor-explosion0857AMStory,2017-10-26 08:02:31,858,67,67,363,8,93,4,389,1,0,-0.38181818181818183,asia,indonesia-fireworks-factor-explosion
5550296508_10157497164046509,"b'An unexpected fossil find in Morocco significantly altered our origin story. Meet the team piecing together 100,000 years of humanity.'",b'These fossils are rewriting the history of humanity',link,http://www.cnn.com/2017/10/25/africa/inside-africa-morocco-homo-sapiens-fossils/index.html?sr=fbCNN102517inside-africa-morocco-homo-sapiens-fossils0845PMVODtopLink,2017-10-26 06:31:15,2057,147,519,1707,81,246,18,5,0,0,0.13428571428571429,africa,inside-africa-morocco-homo-sapiens-fossils
5550296508_10157497076751509,"b""The nuclear-powered USS South Dakota marks the US Navy's latest effort to maintain undersea superiority.""","b""US launches 'most advanced' stealth sub amid undersea rivalry""",link,http://www.cnn.com/2017/10/26/politics/navy-uss-south-dakota-submarine-china-russia/index.html?sr=fbCNN102617navy-uss-south-dakota-submarine-china-russia0115PMVODtop,2017-10-26 06:01:03,902,98,116,825,38,30,5,2,2,0,0.2532467532467532,politics,navy-uss-south-dakota-submarine-china-russia
5550296508_10157496992821509,"b'If these systems do all merge (and it\'s a big if), you may hear people begin to reference the ""perfect storm""'",b'A significant storm could hit New York',link,http://www.cnn.com/2017/10/25/us/new-york-storm/index.html?sr=fbCNN102517new-york-storm0654PMStory,2017-10-26 05:30:34,5698,565,2285,3037,43,2170,44,385,19,0,-0.059564073656520104,us,new-york-storm
5550296508_10157496942951509,b'Previously vaccinated adults are advised to revaccinate',b'CDC recommends new shingles vaccine to replace older one',link,http://www.cnn.com/2017/10/25/health/cdc-new-shingles-vaccine/index.html?sr=fbCNN102517cdc-new-shingles-vaccine0628PMVODtopLink,2017-10-26 05:00:13,2892,551,2428,2109,35,598,92,21,37,0,0.044061302681992334,health,cdc-new-shingles-vaccine
5550296508_10157496896386509,"b'Both mothers and fathers will now have 12 weeks of paid leave, up from six weeks under the previous policy'",b'IBM doubles paid time off for new parents',link,http://money.cnn.com/2017/10/25/technology/ibm-parental-leave/index.html?sr=fbCNN102517ibm-parental-leave0650PMStory,2017-10-26 04:30:17,5275,129,408,4523,626,112,9,2,3,0,0.41888297872340424,technology,ibm-parental-leave
5550296508_10157496808526509,"b'""It is, without question, central to the job of every one of the 535 members of Congress to speak as accurately as they can and to make sure the President of the United States does the same,"" CNN\'s Chris Cillizza writes.'","b""Cillizza: This Republican senator doesn't think it's his job to say when Trump is lying""",link,http://www.cnn.com/2017/10/25/politics/jim-risch-wolf-blitzer-lies/index.html?sr=fbCNN102517jim-risch-wolf-blitzer-lies1102PMVODtopLink,2017-10-26 03:31:05,2107,704,382,913,14,109,144,94,833,0,-0.32202680067001677,politics,jim-risch-wolf-blitzer-lies
5550296508_10157496610311509,"b'Since January 1, retailers have announced plans to shutter more than 6,700 stores in the US.'",b'2017 just set the all-time record for store closings',link,http://money.cnn.com/2017/10/25/news/economy/store-closings-2017/index.html?sr=fbCNN102517economy1046PMStoryLink,2017-10-26 01:31:05,1550,403,487,738,25,312,25,431,19,0,-0.24630541871921183,news,
5550296508_10157496472226509,"b'""The contract should be voided right away and a proper process which is clear, transparent, legal, moral and ethical should take place.""'","b""San Juan's mayor takes on small Montana firm over Puerto Rico power contract""",link,http://money.cnn.com/2017/10/25/news/economy/whitefish-san-juan-mayor/index.html?sr=fbCNN102517economy1047PMStoryLink,2017-10-26 00:30:22,9954,836,947,8759,849,145,110,21,70,0,0.3631799163179916,news,
5550296508_10157496375036509,"b""A few things to keep in mind:\n- A boost to income won't happen right away\n- More income per household doesn't mean per paycheck""","b""Reality check: Will Trump's tax plan really give you a $4,000 pay raise?""",link,http://money.cnn.com/2017/10/25/news/economy/trump-tax-plan-pay-raise/?sr=fbCNN102617economy1207PMStory,2017-10-26 00:00:23,1816,891,206,681,17,29,705,34,350,0,0.14889867841409693,news,
5550296508_10157496308621509,"b""Hillary Clinton was unaware of the now-infamous dossier of allegations about Donald J. Trump and Russia prior to Buzzfeed's publishing of the document earlier this year, source says.""",b'Clinton unaware of dossier before it was published',link,http://www.cnn.com/2017/10/26/politics/hillary-clinton-dossier-buzzfeed/index.html?sr=fbCNN102617hillary-clinton-dossier-buzzfeed1224PMVODtop,2017-10-25 23:30:10,2948,2674,295,1678,103,51,1050,13,53,0,0.4279527559055118,politics,hillary-clinton-dossier-buzzfeed
5550296508_10157496247311509,"b'Journalist and author Mark Halperin sexually harassed women while at ABC News, five women tell CNN. He apologized for inappropriate behavior.'","b""Five women accuse journalist and 'Game Change' co-author Mark Halperin of sexual harassment""",link,http://money.cnn.com/2017/10/25/media/mark-halperin-sexual-harassment-allegations/index.html?sr=fbCNN102617mark-halperin-sexual-harassment-allegations1150AMStory,2017-10-25 23:00:20,911,231,151,400,6,180,45,42,238,0,-0.22407045009784735,media,mark-halperin-sexual-harassment-allegations
5550296508_10157496178346509,b'The use of American companies to push Russian propaganda goes beyond social media sites like Facebook.',b'Russian troll sites kept online by American companies',link,http://money.cnn.com/2017/10/25/media/itl-green-floid-cloudflare-russian-sites/index.html?sr=fbCNN102517itl-green-floid-cloudflare-russian-sites0316PMStory,2017-10-25 22:30:14,720,229,129,364,16,44,46,17,233,0,-0.2640449438202247,media,itl-green-floid-cloudflare-russian-sites
5550296508_10157496117941509,"b'Congress has mandated the public release of the still-secret documents -- including FBI and CIA files -- by the Thursday deadline, barring any action by the President to block the release of certain documents.'",b'President Trump to release JFK files Thursday',link,http://www.cnn.com/2017/10/25/politics/trump-jfk-files-thursday-release/index.html?sr=fbCNN102517trump-jfk-files-thursday-release1033PMVODtopLink,2017-10-25 22:00:49,2347,516,643,1983,105,184,36,13,26,0,0.1401098901098901,politics,trump-jfk-files-thursday-release
5550296508_10157496032381509,"b'""We\'re going to check into it,"" says Republican Senator Bob Corker, chairman of the Senate Foreign Relations Committee.'",b'White House facing scrutiny for Russia sanctions delay',link,http://www.cnn.com/2017/10/25/politics/trump-russia-sanctions/index.html?sr=fbCNN102517trump-russia-sanctions1031PMVODtopLink,2017-10-25 21:32:25,1087,254,141,810,32,29,64,11,141,0,-0.10108303249097472,politics,trump-russia-sanctions
5550296508_10157495583771509,"b""Here are some of the powerful men who've faced accusations since the sexual assault allegations against Harvey Weinstein 20 days ago""",b'The (incomplete) list of powerful men accused of sexual harassment after Harvey Weinstein',link,http://www.cnn.com/2017/10/25/us/list-of-accused-after-weinstein-scandal-trnd/index.html?sr=fbCNN102517list-of-accused-after-weinstein-scandal-trnd0644PMStory,2017-10-25 19:00:45,2059,759,382,1274,36,253,82,53,361,0,-0.18853503184713377,us,list-of-accused-after-weinstein-scandal-trnd
5550296508_10157495456071509,b'Shattering the magic of Christmas for millions of children before retracting the statement',"b'Air Force plays Grinch, briefly denies the existence of Santa Claus'",link,http://www.cnn.com/2017/10/25/politics/air-force-santa-claus/index.html?sr=fbCNN102517air-force-santa-claus0617PMStoryGal,2017-10-25 18:00:27,891,256,123,451,30,92,258,19,41,0,0.2590909090909091,politics,air-force-santa-claus
5550296508_10157495378791509,"b'""We don\'t want any more visits to rehab centers and photo-ops, saying how courageous we are. Enough already. We want to save lives.""'","b""Opioid panel member Patrick Kennedy: 'We want medicine, not media'""",link,http://www.cnn.com/2017/10/25/politics/patrick-kennedy-opioid-commission-reaction/index.html?sr=fbCNN102517patrick-kennedy-opioid-commission-reaction0605PMStory,2017-10-25 17:30:05,939,135,63,843,75,4,14,2,1,0,0.4479166666666667,politics,patrick-kennedy-opioid-commission-reaction
5550296508_10157495291496509,"b""The head of a data analytics company linked to the Trump campaign contacted WikiLeaks founder Julian Assange in 2016 regarding thousands of Hillary Clinton's emails kept on a private server, according to sources familiar with the outreach""",b'Trump campaign analytics company contacted WikiLeaks about Clinton emails',link,http://www.cnn.com/2017/10/25/politics/cambridge-analytica-julian-assange-wikileaks-clinton-emails/index.html?sr=fbCNN102517cambridge-analytica-julian-assange-wikileaks-clinton-emails0535PMStory,2017-10-25 17:00:13,1815,791,469,843,54,319,106,17,476,0,-0.1712962962962963,politics,cambridge-analytica-julian-assange-wikileaks-clinton-emails
5550296508_10157495162001509,"b'The same weekend she laid her son to rest, the mother of a Las Vegas shooting victim had a heart attack and died'",b'Mother of Las Vegas shooting victim dies the weekend of his funeral',link,http://www.cnn.com/2017/10/25/health/vegas-victim-mom-death/index.html?sr=fbCNN102517vegas-victim-mom-death0438PMStoryLink,2017-10-25 16:28:05,25873,1070,1793,2681,144,1055,19,21897,77,0,-0.4702268023456364,health,vegas-victim-mom-death
5550296508_10157495029381509,"b'To be clear, this is not Eric Paddock, the brother who lives in Florida and spoke extensively to the media after the massacre'","b""Las Vegas shooter's brother charged with having child porn""",link,http://www.cnn.com/2017/10/25/us/las-vegas-gunman-brother-child-pornography-charges/index.html?sr=fbCNN102517las-vegas-gunman-brother-child-pornography-charges0343PMStory,2017-10-25 15:54:02,3854,668,489,1749,32,1012,129,85,847,0,-0.1831353919239905,us,las-vegas-gunman-brother-child-pornography-charges
5550296508_10157494926241509,b'The highest ever percentage of Americans',b'Poll: Majority of Republicans support marijuana legalization',link,http://www.cnn.com/2017/10/25/politics/marijuana-legalization-republicans-poll/index.html?sr=fbCNN102517marijuana-legalization-republicans-poll0247PMStory,2017-10-25 15:20:17,4680,529,494,3973,439,78,159,8,23,0,0.400990099009901,politics,marijuana-legalization-republicans-poll
5550296508_10157494806636509,"b'Three employees say Tesla\'s auto manufacturing facility was so hostile to black workers that it was ""straight from the Jim Crow era""'",b'Tesla factory at center of discrimination lawsuits',link,http://money.cnn.com/2017/10/25/technology/culture/tesla-factory-work-culture/index.html?sr=fbCNN102517culture0340PMStory,2017-10-25 14:43:04,1165,284,196,570,31,275,49,52,188,0,-0.13445378151260504,technology,
5550296508_10157494653506509,b'Bush apologized after an actress alleged the former president touched her inappropriately four years ago.',b'George H.W. Bush responds to sexual assault claim',link,http://www.cnn.com/2017/10/25/entertainment/heather-lind-george-bush-harassment/index.html?sr=fbCNN102517heather-lind-george-bush-harassment0158PMStory,2017-10-25 14:00:44,5918,3134,701,3246,82,952,1249,177,212,0,0.17627245508982037,entertainment,heather-lind-george-bush-harassment
5550296508_10157494652446509,"b'A Twitter user accused her of being in a bubble and not knowing real people. In response, CNN anchor Brianna Keilar writes about covering the news with a husband deployed.'","b""'With my husband deployed, covering the news hits home'""",link,http://www.cnn.com/2017/10/25/opinions/brianna-keilar-my-twitter-exchange-while-husband-on-sixth-deployment/index.html?sr=fbCNN102517brianna-keilar-my-twitter-exchange-while-husband-on-sixth-deployment1002AMVODtopLink,2017-10-25 14:00:31,3422,233,234,2661,470,31,12,244,4,0,0.15374507227332457,opinions,brianna-keilar-my-twitter-exchange-while-husband-on-sixth-deployment
5550296508_10157494534371509,"b'""I haven\'t decided to run,"" Biden told Vanity Fair. ""But I\'ve decided I\'m not going to decide not to run. We\'ll see what happens.""'",b'Biden 2020? Former VP leaves door wide open to presidential run',link,http://www.cnn.com/2017/10/25/politics/joe-biden-vanity-fair-interview-2020/index.html?sr=fbCNN102517joe-biden-vanity-fair-interview-20200138PMVODtopLink,2017-10-25 13:30:26,9685,1328,613,7304,1906,54,386,6,29,0,0.4739605207895842,politics,joe-biden-vanity-fair-interview-2020
5550296508_10157494229941509,"b'""I think you should take his words literally."" A senior North Korean official has issued a stern warning to the world.'","b""North Korean official warns to take hydrogen bomb threat 'literally'""",link,http://www.cnn.com/2017/10/25/politics/north-korea-us-hydrogen-bomb-threat/index.html?sr=fbCNN102517north-korea-us-hydrogen-bomb-threat1240PMStory,2017-10-25 12:28:07,2219,496,578,1442,16,289,124,212,136,0,-0.13384813384813385,politics,north-korea-us-hydrogen-bomb-threat
5550296508_10157494132941509,b'A private flight for $60',"b'For $60, woman gets an entire plane to herself during a flight to Greece'",link,http://www.cnn.com/travel/article/only-passenger-in-plane-trnd/index.html?sr=fbCNN102517only-passenger-in-plane-trnd1218PMStoryLink,2017-10-25 12:02:51,8179,324,313,6486,462,944,274,8,5,0,0.21352628470171295,index.html?sr=fbCNN102517only-passenger-in-plane-trnd1218PMStoryLink,
5550296508_10157493927926509,"b""Notice the similarities in these three recent tweets by President Donald J. Trump? CNN's Chris Cillizza did.""",b'President Trump tweets a lot about receiving standing ovations',link,http://www.cnn.com/2017/10/25/politics/trump-standing-ovations/index.html?sr=fbCNN102517trump-standing-ovations1138AMStory,2017-10-25 11:00:36,3948,1776,246,948,27,95,2182,148,548,0,0.25216666666666665,politics,trump-standing-ovations
5550296508_10157493833921509,"b'The early rock \'n\' roll legend had hits such as ""Ain\'t That a Shame,"" ""Blueberry Hill"" and ""Blue Monday""'","b""Fats Domino dead at 89, medical examiner's office says""",link,http://www.cnn.com/2017/10/25/entertainment/fats-domino-obituary/index.html?sr=fbCNN102517fats-domino-obituary1121AMStoryLink,2017-10-25 10:30:19,3857,248,1051,1399,136,49,3,2261,9,0,-0.43348250610252237,entertainment,fats-domino-obituary
5550296508_10157493728581509,"b'It was ""one of the most powerful political speeches in the modern era of the Senate,"" CNN\'s Chris Cillizza writes.'",b'This senator just gave the most important political speech of 2017',link,http://www.cnn.com/2017/10/25/politics/flake-speech-trump-gop/index.html?sr=fbCNN102517flake-speech-trump-gop1046AMVODtop,2017-10-25 10:00:30,6709,913,369,5596,855,34,203,6,15,0,0.46585804132973946,politics,flake-speech-trump-gop
5550296508_10157493672366509,"b'""I want everyone to see what\'s happening with us here. It\'s not just what you\'re seeing on TV: the protests, the clashes. \n\n""We are in the hospital suffering.""'","b""'We are in the hospital suffering': A child's life cut short amid Venezuela crisis""",link,http://www.cnn.com/2017/10/25/health/venezuela-child-hospital-dying/index.html?sr=fbCNN102517venezuela-child-hospital-dying1037AMVODtopLink,2017-10-25 09:41:09,1753,134,238,538,23,21,2,1092,77,0,-0.4707818930041152,health,venezuela-child-hospital-dying
5550296508_10157493558371509,"b'Alexa, is it a good idea to let strangers into my house?'",b'Amazon will let delivery people inside your house now',link,http://money.cnn.com/2017/10/25/technology/business/amazon-key-delivery/index.html?sr=fbCNN102517business0939AMStory,2017-10-25 09:02:19,1441,772,306,639,22,337,205,11,227,0,-0.00685785536159601,technology,
5550296508_10157493413501509,"b'""It\'s a mountain that just doesn\'t seem like it\'s gonna be climbable,"" one victim said from his hospital bed.'",b'Las Vegas shooting victims struggle to afford mounting medical costs',link,http://money.cnn.com/2017/10/25/pf/insurance/las-vegas-shooting-health-care/index.html?sr=fbCNN102517insurance0858AMStory,2017-10-25 08:30:47,7099,1556,1678,1682,28,146,24,4051,1168,0,-0.4769244969540336,pf,
5550296508_10157493281331509,"b""Despite two key Republican senators publicly condemning President Donald J. Trump, there's a new truth about today's GOP. You either stand with him or you get out of town.""","b""Flake, Corker can't break the GOP fever""",link,http://www.cnn.com/2017/10/25/politics/donald-trump-corker-flake-republican-party/index.html?sr=fbCNN102517donald-trump-corker-flake-republican-party0819AMVODtop,2017-10-25 08:00:06,1665,1058,161,757,43,50,61,305,449,0,-0.3579295154185022,politics,donald-trump-corker-flake-republican-party
5550296508_10157493197121509,"b""She's not horsing around.""",b'Queen Elizabeth II has earned over $8 million in horse racing prize money',link,http://www.cnn.com/2017/10/25/sport/queen-elizabeth-horse-racing-prize-money/index.html?sr=fbCNN102517queen-elizabeth-horse-racing-prize-money0820AMStoryGal,2017-10-25 07:30:16,2724,227,155,2116,56,305,229,4,14,0,0.21957236842105263,sport,queen-elizabeth-horse-racing-prize-money
5550296508_10157493037546509,"b""As President Donald J. Trump's travel ban restrictions expire, refugees from all countries will be allowed -- but with new, enhanced vetting rules""",b'Trump administration to resume refugee admissions with enhanced vetting',link,http://www.cnn.com/2017/10/24/politics/trump-refugees-enhanced-vetting/index.html?sr=fbCNN102517trump-refugees-enhanced-vetting0709AMVODtop,2017-10-25 06:30:10,735,239,76,590,56,13,18,9,49,0,0.05517241379310345,politics,trump-refugees-enhanced-vetting
5550296508_10157492967781509,"b'The group issued an advisory Tuesday, saying it has noticed ""a pattern of disturbing incidents reported by African-American passengers, specific to American Airlines.""'",b'NAACP warns black passengers about traveling with American Airlines',link,http://money.cnn.com/2017/10/25/news/companies/naacp-travel-advisory-american-airlines/index.html,2017-10-25 06:00:19,3031,527,1189,1353,26,852,107,209,484,0,-0.16686531585220502,news,
5550296508_10157492905526509,"b'Saudi Arabia\'s crown prince has vowed to destroy ""extremist ideologies"" in a bid to return to ""a more moderate Islam.""'","b""Saudi crown prince promises 'a more moderate Islam'""",link,http://www.cnn.com/2017/10/24/middleeast/saudi-arabia-prince-more-moderate-islam/index.html?sr=fbCNN102517saudi-arabia-prince-more-moderate-islam1149AMVODtop,2017-10-25 05:32:03,5482,558,365,4740,351,67,305,0,19,0,0.42924528301886794,middleeast,saudi-arabia-prince-more-moderate-islam
5550296508_10157492848076509,b'Will you pay $70 to see the Grand Canyon National Park or Yosemite National Park?',b'National Park Service proposes price hike for 17 popular parks',link,http://www.cnn.com/travel/article/national-park-service-fee-proposal/index.html?sr=fbCNN102517national-park-service-fee-proposal0218PMStoryGal,2017-10-25 05:00:41,2153,693,434,738,24,294,24,171,902,0,-0.3621908127208481,index.html?sr=fbCNN102517national-park-service-fee-proposal0218PMStoryGal,
5550296508_10157492798051509,"b'""It all adds up to a pretty entertaining sideshow. The real world consequences, however, are less clear,"" CNN\'s Gregory Krieg writes of Senator Bob Corker and Senator Jeff Flake\'s remarks about President Donald J. Trump.'","b""It's one thing to criticize Trump. It's another to vote against him.""",link,http://www.cnn.com/2017/10/24/politics/corker-flake-trump-republicans-tax-plan/index.html?sr=fbCNN102417corker-flake-trump-republicans-tax-plan1048PMVODtopLink,2017-10-25 04:30:27,1325,488,123,1078,57,21,112,22,35,0,0.22672064777327935,politics,corker-flake-trump-republicans-tax-plan
